{
  "schemaVersion": 2,
  "profileId": "profile_demo_ada",
  "displayName": "Ada",
  "createdAt": "2026-10-03T15:00:00Z",
  "confirmedAt": "2026-10-03T15:01:35Z",
  "states": [
    {
      "id": "calm-before-pitch",
      "label": "calm before a pitch",
      "words": "Like the room is already mine and there's no rush",
      "memoryCue": "the Berlin demo",
      "leverage": "So I stop rushing the part that matters",
      "strategy": {
        "steps": [
          {
            "modality": "visual",
            "direction": "external",
            "content": "the first face in the room looking up at me",
            "submodalities": {
              "core": {
                "location": "center",
                "size": "life-size",
                "distance": "close",
                "brightness": "bright",
                "perspective": "associated"
              },
              "extended": {
                "motion": "movie"
              },
              "words": {
                "distance": "right there, like across a table"
              }
            },
            "anchorDetail": {
              "kind": "scene",
              "caption": "The first face looking up",
              "details": [
                "warm window light",
                "a coffee cup on the table"
              ]
            }
          },
          {
            "modality": "auditory",
            "direction": "internal",
            "content": "'here we go, slow'",
            "submodalities": {
              "core": {
                "source": "my own voice",
                "volume": "quiet",
                "location": "inside-head"
              },
              "extended": {
                "tempo": "slow"
              }
            }
          },
          {
            "modality": "kinesthetic",
            "direction": "internal",
            "content": "warmth spreading through my chest",
            "submodalities": {
              "core": {
                "bodyLocation": "chest",
                "intensity": 8,
                "movement": "moving"
              },
              "extended": {
                "temperature": "warm",
                "direction": "spreading"
              }
            }
          }
        ],
        "fullyInAt": 2,
        "confirmed": true
      },
      "anchorStep": 0,
      "contrast": {
        "label": "stuck on a small email",
        "submodalities": {
          "visual": {
            "core": {
              "location": "lower-left",
              "size": "small",
              "distance": "far",
              "brightness": "dim",
              "perspective": "dissociated"
            }
          },
          "auditory": {
            "core": {
              "source": "my own voice",
              "volume": "loud",
              "location": "inside-head"
            },
            "extended": {
              "tempo": "fast"
            }
          },
          "kinesthetic": {
            "core": {
              "bodyLocation": "stomach",
              "intensity": 3,
              "movement": "still"
            }
          }
        },
        "prefilled": true
      },
      "differences": [
        {
          "stepIndex": 0,
          "modality": "visual",
          "attribute": "location",
          "peak": "center",
          "contrast": "lower-left",
          "ratingDelta": 1
        },
        {
          "stepIndex": 0,
          "modality": "visual",
          "attribute": "size",
          "peak": "life-size",
          "contrast": "small",
          "ratingDelta": 1
        },
        {
          "stepIndex": 0,
          "modality": "visual",
          "attribute": "distance",
          "peak": "close",
          "contrast": "far",
          "ratingDelta": 3
        },
        {
          "stepIndex": 0,
          "modality": "visual",
          "attribute": "brightness",
          "peak": "bright",
          "contrast": "dim",
          "ratingDelta": 2
        },
        {
          "stepIndex": 0,
          "modality": "visual",
          "attribute": "perspective",
          "peak": "associated",
          "contrast": "dissociated",
          "ratingDelta": 1
        },
        {
          "stepIndex": 1,
          "modality": "auditory",
          "attribute": "volume",
          "peak": "quiet",
          "contrast": "loud",
          "ratingDelta": 2
        },
        {
          "stepIndex": 1,
          "modality": "auditory",
          "attribute": "tempo",
          "peak": "slow",
          "contrast": "fast",
          "ratingDelta": 1
        },
        {
          "stepIndex": 2,
          "modality": "kinesthetic",
          "attribute": "movement",
          "peak": "moving",
          "contrast": "still",
          "ratingDelta": 1
        }
      ],
      "drivers": [
        2,
        3,
        5
      ],
      "recode": {
        "appliedDrivers": [
          2,
          3,
          5
        ]
      },
      "test": {
        "before": 3,
        "after": 7
      },
      "futurePace": {
        "situation": "Thursday's board pitch"
      },
      "calibration": {
        "peak": {
          "stateId": "calm-before-pitch",
          "phase": "peak",
          "source": "simulator",
          "hr": {
            "mean": 68.2,
            "sd": 2.1
          },
          "lnRmssd": {
            "mean": 3.95,
            "sd": 0.12
          },
          "windows": 5,
          "seconds": 40,
          "quality": "ok",
          "speechExcludedSeconds": 8,
          "recordedAt": "2026-10-03T15:00:40Z",
          "rating": 8
        },
        "contrast": {
          "stateId": "calm-before-pitch",
          "phase": "contrast",
          "source": "simulator",
          "hr": {
            "mean": 79.5,
            "sd": 3.0
          },
          "lnRmssd": {
            "mean": 3.45,
            "sd": 0.15
          },
          "windows": 3,
          "seconds": 24,
          "quality": "ok",
          "speechExcludedSeconds": 4,
          "recordedAt": "2026-10-03T15:01:10Z",
          "rating": 3,
          "separability": {
            "separable": true,
            "hr": 4.36,
            "lnRmssd": 3.68
          }
        }
      }
    }
  ]
}
